{
  "schema_version": "1.0.0",
  "feature": "rabbit-feature",
  "owner": "rabbit-workflow team",
  "deprecation_criterion": "when Claude Code natively supports feature lifecycle management",
  "targets": [
    {"name": "skills/rabbit-feature-touch/SKILL.md", "type": "copy-file", "source": "skills/rabbit-feature-touch/SKILL.md", "destination": ".claude/skills/rabbit-feature-touch/SKILL.md", "check_on_stop": true},
    {"name": "skills/rabbit-feature-scope/SKILL.md", "type": "copy-file", "source": "skills/rabbit-feature-scope/SKILL.md", "destination": ".claude/skills/rabbit-feature-scope/SKILL.md", "check_on_stop": true},
    {"name": "skills/rabbit-feature-new/SKILL.md", "type": "copy-file", "source": "skills/rabbit-feature-new/SKILL.md", "destination": ".claude/skills/rabbit-feature-new/SKILL.md", "check_on_stop": true},
    {"name": "skills/rabbit-feature-audit/SKILL.md", "type": "copy-file", "source": "skills/rabbit-feature-audit/SKILL.md", "destination": ".claude/skills/rabbit-feature-audit/SKILL.md", "check_on_stop": true},
    {"name": "skills/rabbit-feature-spec/SKILL.md", "type": "copy-file", "source": "skills/rabbit-feature-spec/SKILL.md", "destination": ".claude/skills/rabbit-feature-spec/SKILL.md", "check_on_stop": true}
  ]
}
